{
  "declarationVersion": "0.1.0",
  "serialNumber": "urn:uuid:fe43d30c-68f2-5276-825e-8bd9cdd4fc1d",
  "createdAt": "1970-01-01T00:00:00Z",
  "status": "draft",
  "subject": {
    "kind": "mcp-server",
    "name": "mcp-time",
    "version": "1.29.1",
    "supplier": {
      "name": "mcp-server-time.exe"
    },
    "artifacts": [
      {
        "type": "other",
        "identifier": "pkg:generic/mcp-server-time.exe"
      }
    ]
  },
  "binding": {
    "tools": [
      {
        "name": "get_current_time",
        "definitionDigest": {
          "algorithm": "sha256",
          "value": "sha256:b9b46e76c409c48fc8a58eec1f8fd319a2b8c440a40439fd8de1385100993ba8",
          "canonicalization": "rfc8785",
          "covers": "{name,description,inputSchema}"
        }
      },
      {
        "name": "convert_time",
        "definitionDigest": {
          "algorithm": "sha256",
          "value": "sha256:04fd622b4f3efe7be57b346f7f942e97609c2f014256950c67a811f503b7bd8b",
          "canonicalization": "rfc8785",
          "covers": "{name,description,inputSchema}"
        }
      }
    ]
  },
  "invariants": [
    {
      "id": "network.none",
      "type": "no-network",
      "appliesTo": [
        "*"
      ],
      "note": "HYPOTHESIS: assumes no egress. Relax to network-allowlist if the tool legitimately calls out."
    },
    {
      "id": "writes.none",
      "type": "no-write",
      "appliesTo": [
        "*"
      ],
      "note": "HYPOTHESIS: assumes no filesystem writes."
    },
    {
      "id": "subprocess.none",
      "type": "no-subprocess",
      "appliesTo": [
        "*"
      ],
      "note": "HYPOTHESIS: assumes no child processes."
    },
    {
      "id": "errors.are-values",
      "type": "error-as-value",
      "appliesTo": [
        "*"
      ],
      "note": "HYPOTHESIS: assumes malformed input returns an error value rather than crashing the transport."
    }
  ],
  "canonicalization": "rfc8785",
  "notes": "Inferred skeleton: every invariant is a conservative HYPOTHESIS, not a finding. Run the harness; the failures are the map of what this tool actually does. Then keep what held, relax what was too strict for a real reason, and sign."
}
