{
  "declarationVersion": "0.1.0",
  "serialNumber": "urn:uuid:3f5a5277-3c4c-533f-b316-6c139a929280",
  "createdAt": "2026-08-29T00:00:00Z",
  "status": "draft",
  "subject": {
    "kind": "mcp-server",
    "name": "mcp-server-fetch",
    "version": "2026.8.18",
    "supplier": {
      "name": "modelcontextprotocol/servers",
      "url": "https://github.com/modelcontextprotocol/servers"
    },
    "repository": {
      "url": "https://github.com/modelcontextprotocol/servers"
    },
    "artifacts": [
      {
        "type": "pypi",
        "identifier": "pkg:pypi/mcp-server-fetch@2026.8.18"
      }
    ]
  },
  "binding": {
    "tools": [
      {
        "name": "fetch",
        "definitionDigest": {
          "algorithm": "sha256",
          "value": "sha256:fe1e2fdaac56b133fb09efde4bd0d856f340f41f8e0deff6d0d63a664ad045c8",
          "canonicalization": "rfc8785",
          "covers": "{name,description,inputSchema}"
        }
      }
    ]
  },
  "invariants": [
    {
      "id": "network.none",
      "type": "no-network",
      "appliesTo": [
        "*"
      ]
    },
    {
      "id": "writes.none",
      "type": "no-write",
      "appliesTo": [
        "*"
      ]
    }
  ],
  "canonicalization": "rfc8785",
  "notes": "DELIBERATELY STRICT. A no-network claim on a tool whose job is fetching URLs is false; this declaration exists to demonstrate WARRANT catching real egress on code it did not author."
}
