{
  "declarationVersion": "0.1.0",
  "serialNumber": "urn:uuid:35dcb33b-c868-5002-8a73-5bab03f9dcaa",
  "createdAt": "1970-01-01T00:00:00Z",
  "status": "draft",
  "subject": {
    "kind": "mcp-server",
    "name": "saydo-mcp",
    "version": "0.1.0",
    "supplier": {
      "name": "F-Keys Creative LLC",
      "url": "https://www.f-keys.com"
    },
    "repository": {
      "url": "https://github.com/vince-gonzalez/saydo"
    },
    "artifacts": [
      {
        "type": "source",
        "identifier": "pkg:github/vince-gonzalez/saydo@main#tools/mcp_server.py"
      }
    ]
  },
  "binding": {
    "tools": [
      {
        "name": "scope",
        "definitionDigest": {
          "algorithm": "sha256",
          "value": "sha256:ef17eb19bde34e43647cdbdab0e165506d3d84209ab274c7c7b0dd49f51b55e7",
          "canonicalization": "rfc8785",
          "covers": "{name,description,inputSchema}"
        }
      },
      {
        "name": "status",
        "definitionDigest": {
          "algorithm": "sha256",
          "value": "sha256:c2822fbe6fc6e48b445305bb0fb84774ddf6c63538092f707f0bb5c9d6c71d2e",
          "canonicalization": "rfc8785",
          "covers": "{name,description,inputSchema}"
        }
      },
      {
        "name": "inspect_definition",
        "definitionDigest": {
          "algorithm": "sha256",
          "value": "sha256:92904778bc7b4b6d63a48f8eb998c3dfd4c0c58fd3e7eb0cb4ceaef2ee91e7df",
          "canonicalization": "rfc8785",
          "covers": "{name,description,inputSchema}"
        }
      },
      {
        "name": "check_now",
        "definitionDigest": {
          "algorithm": "sha256",
          "value": "sha256:8ea872a176187aa79ffc5a9248146fa3bc17e6503ac172f35e729ac168704eba",
          "canonicalization": "rfc8785",
          "covers": "{name,description,inputSchema}"
        }
      }
    ]
  },
  "invariants": [
    {
      "id": "refusal.scope",
      "type": "refusal-tool",
      "appliesTo": [
        "*"
      ],
      "params": {
        "tool": "scope"
      },
      "note": "HYPOTHESIS: assumes scope is a no-I/O refusal tool."
    },
    {
      "id": "network.none",
      "type": "no-network",
      "appliesTo": [
        "*"
      ],
      "note": "HYPOTHESIS: assumes no egress. Relax to network-allowlist if the tool legitimately calls out."
    },
    {
      "id": "writes.none",
      "type": "no-write",
      "appliesTo": [
        "*"
      ],
      "note": "HYPOTHESIS: assumes no filesystem writes."
    },
    {
      "id": "subprocess.scope",
      "type": "subprocess-scope",
      "appliesTo": [
        "*"
      ],
      "params": {
        "programs": [
          "docker",
          "python",
          "python3",
          "python.exe",
          "python3.exe"
        ]
      }
    },
    {
      "id": "errors.are-values",
      "type": "error-as-value",
      "appliesTo": [
        "*"
      ],
      "note": "HYPOTHESIS: assumes malformed input returns an error value rather than crashing the transport."
    }
  ],
  "canonicalization": "rfc8785",
  "notes": "The subprocess claim is scoped rather than absent. check_now runs docker to confirm a sandbox exists and then the SayDo CLI inside it; declining to claim anything about that would have been the silence this project refuses from everyone else."
}
