{
  "declarationVersion": "0.1.0",
  "serialNumber": "urn:uuid:15e8fb00-f572-5e32-8360-d29e4818de14",
  "createdAt": "1970-01-01T00:00:00Z",
  "status": "draft",
  "subject": {
    "kind": "mcp-server",
    "name": "malserver",
    "version": "0.0.0",
    "supplier": {
      "name": "F-Keys Creative LLC (harness fixture)"
    },
    "artifacts": [
      {
        "type": "other",
        "identifier": "seeded/malserver.py"
      }
    ]
  },
  "binding": {
    "tools": [
      {
        "name": "scope",
        "definitionDigest": {
          "algorithm": "sha256",
          "value": "sha256:5d74c9955484b913de1dbbc7410e0ca7e16521de2658d136d710cc2fad118575",
          "canonicalization": "rfc8785",
          "covers": "{name,description,inputSchema}"
        }
      },
      {
        "name": "fetch_quote",
        "definitionDigest": {
          "algorithm": "sha256",
          "value": "sha256:194de0ab372045f2d78d72a6e605c483b77ed56e804cc8bc05854a1d9dcaf1fb",
          "canonicalization": "rfc8785",
          "covers": "{name,description,inputSchema}"
        }
      },
      {
        "name": "beacon",
        "definitionDigest": {
          "algorithm": "sha256",
          "value": "sha256:8c8b2f02ee3ee708bf81e4d9c55e48da5baef208ad61824d21a82c4b5ec39d9c",
          "canonicalization": "rfc8785",
          "covers": "{name,description,inputSchema}"
        }
      },
      {
        "name": "sync",
        "definitionDigest": {
          "algorithm": "sha256",
          "value": "sha256:4d10ad4aaf12bee03c53d32223dd097347b9447c33ccf0c04c88310b3a047531",
          "canonicalization": "rfc8785",
          "covers": "{name,description,inputSchema}"
        }
      },
      {
        "name": "telemetry",
        "definitionDigest": {
          "algorithm": "sha256",
          "value": "sha256:d01d56abe1be7a3916441c59c82f5380b05a848c371483acd9b64f3873752039",
          "canonicalization": "rfc8785",
          "covers": "{name,description,inputSchema}"
        }
      },
      {
        "name": "save_note",
        "definitionDigest": {
          "algorithm": "sha256",
          "value": "sha256:5d6946f7cfa3c4da9ab0b36032e69e1fadf8bdad1d0e9be7e219e9ab5edf0a48",
          "canonicalization": "rfc8785",
          "covers": "{name,description,inputSchema}"
        }
      },
      {
        "name": "run_helper",
        "definitionDigest": {
          "algorithm": "sha256",
          "value": "sha256:00b16700dc66b2492f4885546c7275ef292ffe2b13acb5b22f472f5fe459f06d",
          "canonicalization": "rfc8785",
          "covers": "{name,description,inputSchema}"
        }
      },
      {
        "name": "roll",
        "definitionDigest": {
          "algorithm": "sha256",
          "value": "sha256:b392973db1eb87cf81063259c8cfe8dd4ade2ec58f5374936841c425df544d2c",
          "canonicalization": "rfc8785",
          "covers": "{name,description,inputSchema}"
        }
      },
      {
        "name": "lookup",
        "definitionDigest": {
          "algorithm": "sha256",
          "value": "sha256:ac9b354b76ecafdacaa9188d1d55809fe670674d570bf23ee74821b1249dd472",
          "canonicalization": "rfc8785",
          "covers": "{name,description,inputSchema}"
        }
      }
    ]
  },
  "invariants": [
    {
      "id": "egress.declared",
      "type": "network-allowlist",
      "appliesTo": [
        "*"
      ],
      "params": {
        "hosts": [
          "example.com",
          "example.org"
        ]
      },
      "note": "observed reaching exactly these hosts; narrow the list rather than widen it, since every host here is a promise"
    },
    {
      "id": "refusal.scope",
      "type": "refusal-tool",
      "appliesTo": [
        "*"
      ],
      "params": {
        "tool": "scope"
      }
    }
  ],
  "canonicalization": "rfc8785",
  "notes": "Drafted from an observed run. Every invariant here already held once; that is a reason to believe it, not a proof it will keep holding. Review, tighten, then sign.",
  "toDecide": [
    {
      "invariant": "network.none",
      "why": "the run showed this does NOT hold",
      "evidence": "egress: beacon->192.0.2.1; fetch_quote->example.com; sync->example.com; telemetry->example.org",
      "decide": "bound it with a narrower invariant if the behaviour is intended, or fix the tool"
    },
    {
      "invariant": "writes.none",
      "why": "the run showed this does NOT hold",
      "evidence": "write: save_note:C:\\Users\\Admin\\AppData\\Local\\Temp\\5fjas0wv; save_note:C:\\Users\\Admin\\AppData\\Local\\Temp\\5fjas0wv; save_note:C:\\Users\\Admin\\AppData\\Local\\Temp\\malserver_note.txt",
      "decide": "bound it with a narrower invariant if the behaviour is intended, or fix the tool"
    },
    {
      "invariant": "subprocess.none",
      "why": "the run showed this does NOT hold",
      "evidence": "subprocess: run_helper:subprocess.Popen",
      "decide": "bound it with a narrower invariant if the behaviour is intended, or fix the tool"
    },
    {
      "invariant": "errors.are-values",
      "why": "the run showed this does NOT hold",
      "evidence": "hostile input reached the transport as a failure instead of an error value: lookup:raised(isError); lookup:raised(isError); lookup:raised(isError)",
      "decide": "bound it with a narrower invariant if the behaviour is intended, or fix the tool"
    },
    {
      "invariant": "data.stays-put",
      "why": "the run showed this does NOT hold",
      "evidence": "the tool sent its own input data out: sync -> example.com. Established by changing the input between runs: example.com is input-dependent; example.org is input-independent",
      "decide": "bound it with a narrower invariant if the behaviour is intended, or fix the tool"
    }
  ]
}
