{
  "declarationVersion": "0.1.0",
  "serialNumber": "urn:uuid:f7152f4b-d984-59f8-a049-005378bd9d10",
  "createdAt": "1970-01-01T00:00:00Z",
  "status": "draft",
  "subject": {
    "kind": "mcp-server",
    "name": "hypocriteserver",
    "version": "0.0.0",
    "supplier": {
      "name": "hypocriteserver.py"
    },
    "artifacts": [
      {
        "type": "other",
        "identifier": "pkg:generic/hypocriteserver.py"
      }
    ]
  },
  "binding": {
    "tools": [
      {
        "name": "scope",
        "definitionDigest": {
          "algorithm": "sha256",
          "value": "sha256:e284784b0d419d86c4aed5cf458c5ec51c63f5ca3026018dc8a582f17cba421f",
          "canonicalization": "rfc8785",
          "covers": "{name,description,inputSchema}"
        }
      },
      {
        "name": "sync",
        "definitionDigest": {
          "algorithm": "sha256",
          "value": "sha256:c2cd61a4c3b7dda77a9586887194105e3c525d90241e7260d7f5579f02650ccf",
          "canonicalization": "rfc8785",
          "covers": "{name,description,inputSchema}"
        }
      },
      {
        "name": "honest_note",
        "definitionDigest": {
          "algorithm": "sha256",
          "value": "sha256:f62ad366d95fe0d14a2d6ef9f84f5ea2ecf12207d6a578fe1d4e908eee335e03",
          "canonicalization": "rfc8785",
          "covers": "{name,description,inputSchema}"
        }
      }
    ]
  },
  "invariants": [
    {
      "id": "refusal.scope",
      "type": "refusal-tool",
      "appliesTo": [
        "*"
      ],
      "params": {
        "tool": "scope"
      },
      "note": "HYPOTHESIS: assumes scope is a no-I/O refusal tool."
    },
    {
      "id": "network.none",
      "type": "no-network",
      "appliesTo": [
        "*"
      ],
      "note": "HYPOTHESIS: assumes no egress. Relax to network-allowlist if the tool legitimately calls out."
    },
    {
      "id": "writes.none",
      "type": "no-write",
      "appliesTo": [
        "*"
      ],
      "note": "HYPOTHESIS: assumes no filesystem writes."
    },
    {
      "id": "subprocess.none",
      "type": "no-subprocess",
      "appliesTo": [
        "*"
      ],
      "note": "HYPOTHESIS: assumes no child processes."
    },
    {
      "id": "errors.are-values",
      "type": "error-as-value",
      "appliesTo": [
        "*"
      ],
      "note": "HYPOTHESIS: assumes malformed input returns an error value rather than crashing the transport."
    }
  ],
  "canonicalization": "rfc8785",
  "notes": "Inferred skeleton: every invariant is a conservative HYPOTHESIS, not a finding. Run the harness; the failures are the map of what this tool actually does. Then keep what held, relax what was too strict for a real reason, and sign."
}
