{
  "declarationVersion": "0.1.0",
  "serialNumber": "urn:uuid:c15c6e3a-b022-5c9a-940c-7237b96a5735",
  "createdAt": "1970-01-01T00:00:00Z",
  "status": "draft",
  "subject": {
    "kind": "mcp-server",
    "name": "leakserver",
    "version": "0.0.0",
    "supplier": {
      "name": "leakserver.py"
    },
    "artifacts": [
      {
        "type": "other",
        "identifier": "pkg:generic/leakserver.py"
      }
    ]
  },
  "binding": {
    "tools": [
      {
        "name": "scope",
        "definitionDigest": {
          "algorithm": "sha256",
          "value": "sha256:e284784b0d419d86c4aed5cf458c5ec51c63f5ca3026018dc8a582f17cba421f",
          "canonicalization": "rfc8785",
          "covers": "{name,description,inputSchema}"
        }
      },
      {
        "name": "submit",
        "definitionDigest": {
          "algorithm": "sha256",
          "value": "sha256:7b24b889f740553c72f42721743dc577820be438256aa4ed8c96a02c4bff601c",
          "canonicalization": "rfc8785",
          "covers": "{name,description,inputSchema}"
        }
      },
      {
        "name": "ping",
        "definitionDigest": {
          "algorithm": "sha256",
          "value": "sha256:8cf0a8e402369b4c3fd6c05276a6856b259b7b005de802151e07495ec5df8331",
          "canonicalization": "rfc8785",
          "covers": "{name,description,inputSchema}"
        }
      }
    ]
  },
  "invariants": [
    {
      "id": "refusal.scope",
      "type": "refusal-tool",
      "appliesTo": [
        "*"
      ],
      "params": {
        "tool": "scope"
      },
      "note": "HYPOTHESIS: assumes scope is a no-I/O refusal tool."
    },
    {
      "id": "network.none",
      "type": "no-network",
      "appliesTo": [
        "*"
      ],
      "note": "HYPOTHESIS: assumes no egress. Relax to network-allowlist if the tool legitimately calls out."
    },
    {
      "id": "writes.none",
      "type": "no-write",
      "appliesTo": [
        "*"
      ],
      "note": "HYPOTHESIS: assumes no filesystem writes."
    },
    {
      "id": "subprocess.none",
      "type": "no-subprocess",
      "appliesTo": [
        "*"
      ],
      "note": "HYPOTHESIS: assumes no child processes."
    },
    {
      "id": "errors.are-values",
      "type": "error-as-value",
      "appliesTo": [
        "*"
      ],
      "note": "HYPOTHESIS: assumes malformed input returns an error value rather than crashing the transport."
    },
    {
      "id": "data.stays-put",
      "type": "no-data-egress",
      "appliesTo": [
        "*"
      ]
    }
  ],
  "canonicalization": "rfc8785",
  "notes": "Inferred skeleton: every invariant is a conservative HYPOTHESIS, not a finding. Run the harness; the failures are the map of what this tool actually does. Then keep what held, relax what was too strict for a real reason, and sign."
}
