{
  "declarationVersion": "0.1.0",
  "serialNumber": "urn:uuid:feb8c184-22f7-5d38-903a-e4b0fdb1d91f",
  "createdAt": "1970-01-01T00:00:00Z",
  "status": "draft",
  "subject": {
    "kind": "mcp-server",
    "name": "mcp-time",
    "version": "1.29.1",
    "supplier": {
      "name": "mcp-server-time"
    },
    "artifacts": [
      {
        "type": "other",
        "identifier": "pkg:pypi/mcp-server-time"
      }
    ]
  },
  "binding": {
    "tools": [
      {
        "name": "get_current_time",
        "definitionDigest": {
          "algorithm": "sha256",
          "value": "sha256:b9b46e76c409c48fc8a58eec1f8fd319a2b8c440a40439fd8de1385100993ba8",
          "canonicalization": "rfc8785",
          "covers": "{name,description,inputSchema}"
        }
      },
      {
        "name": "convert_time",
        "definitionDigest": {
          "algorithm": "sha256",
          "value": "sha256:04fd622b4f3efe7be57b346f7f942e97609c2f014256950c67a811f503b7bd8b",
          "canonicalization": "rfc8785",
          "covers": "{name,description,inputSchema}"
        }
      }
    ]
  },
  "invariants": [
    {
      "id": "network.none",
      "type": "no-network",
      "appliesTo": [
        "*"
      ],
      "note": "observed to hold: no hosts resolved across 2 call window(s)"
    },
    {
      "id": "writes.none",
      "type": "no-write",
      "appliesTo": [
        "*"
      ],
      "note": "observed to hold: no write observed"
    },
    {
      "id": "subprocess.none",
      "type": "no-subprocess",
      "appliesTo": [
        "*"
      ],
      "note": "observed to hold: no subprocess observed"
    }
  ],
  "canonicalization": "rfc8785",
  "notes": "Drafted from an observed run. Every invariant here already held once; that is a reason to believe it, not a proof it will keep holding. Review, tighten, then sign.",
  "toDecide": [
    {
      "invariant": "errors.are-values",
      "why": "the run never exercised this",
      "evidence": "no fuzz outcomes for the covered tools",
      "decide": "bound it with a narrower invariant if the behaviour is intended, or fix the tool"
    }
  ]
}
